{
  "schema_version": "unreal-asset-audit@2.0.0",
  "report_id": "report-ecb9beecc5687c2b",
  "created_at": "2026-08-28T03:19:24.105946+00:00",
  "profile_id": "example-desktop-prop-v2",
  "profile_version": "2.0.0",
  "profile_schema_version": "unreal-static-mesh-profile@2.0.0",
  "collection_mode": "unreal_editor",
  "real_unreal_validation": true,
  "host_engine_version": "5.8.1-56057345+++UE5+Release-5.8",
  "asset_count": 4,
  "issue_count": 8,
  "collection_failure_count": 0,
  "requested_asset_count": 4,
  "processed_asset_count": 4,
  "cancelled_asset_count": 0,
  "completed_batch_count": 2,
  "batch_size": 2,
  "assets": [
    {
      "asset_path": "/Engine/BasicShapes/Cone.Cone",
      "asset_name": "Cone",
      "lods": [
        {
          "index": 0,
          "triangles": 284,
          "vertices": 198
        }
      ],
      "material_slot_count": 1,
      "nanite_enabled": false,
      "simple_collision_primitive_count": 4,
      "collision_complexity": "project_default",
      "uv_channel_count": 2,
      "lightmap_coordinate_index": 1,
      "lightmap_resolution": 32
    },
    {
      "asset_path": "/Engine/BasicShapes/Cube.Cube",
      "asset_name": "Cube",
      "lods": [
        {
          "index": 0,
          "triangles": 48,
          "vertices": 54
        }
      ],
      "material_slot_count": 1,
      "nanite_enabled": false,
      "simple_collision_primitive_count": 1,
      "collision_complexity": "project_default",
      "uv_channel_count": 2,
      "lightmap_coordinate_index": 1,
      "lightmap_resolution": 64
    },
    {
      "asset_path": "/Engine/BasicShapes/Cylinder.Cylinder",
      "asset_name": "Cylinder",
      "lods": [
        {
          "index": 0,
          "triangles": 512,
          "vertices": 334
        }
      ],
      "material_slot_count": 1,
      "nanite_enabled": false,
      "simple_collision_primitive_count": 1,
      "collision_complexity": "project_default",
      "uv_channel_count": 2,
      "lightmap_coordinate_index": 1,
      "lightmap_resolution": 32
    },
    {
      "asset_path": "/Engine/BasicShapes/Sphere.Sphere",
      "asset_name": "Sphere",
      "lods": [
        {
          "index": 0,
          "triangles": 960,
          "vertices": 559
        }
      ],
      "material_slot_count": 1,
      "nanite_enabled": false,
      "simple_collision_primitive_count": 1,
      "collision_complexity": "project_default",
      "uv_channel_count": 2,
      "lightmap_coordinate_index": 1,
      "lightmap_resolution": 32
    }
  ],
  "issues": [
    {
      "schema_version": "unreal-asset-audit@1.0.0",
      "issue_id": "issue-56a8e17172a2884f",
      "asset_path": "/Engine/BasicShapes/Cone.Cone",
      "rule_id": "static_mesh.lod_count",
      "severity": "warning",
      "message": "LOD count 1 is below profile minimum 3.",
      "evidence_id": "ev-6b4955343ce848ca"
    },
    {
      "schema_version": "unreal-asset-audit@1.0.0",
      "issue_id": "issue-ab1122a6ccc68bcb",
      "asset_path": "/Engine/BasicShapes/Cone.Cone",
      "rule_id": "static_mesh.nanite_state",
      "severity": "warning",
      "message": "Nanite is disabled; profile expects enabled.",
      "evidence_id": "ev-0de65b05fdb36176"
    },
    {
      "schema_version": "unreal-asset-audit@1.0.0",
      "issue_id": "issue-53351c10a60379a6",
      "asset_path": "/Engine/BasicShapes/Cube.Cube",
      "rule_id": "static_mesh.lod_count",
      "severity": "warning",
      "message": "LOD count 1 is below profile minimum 3.",
      "evidence_id": "ev-c7d42b9fc12bee42"
    },
    {
      "schema_version": "unreal-asset-audit@1.0.0",
      "issue_id": "issue-796dd82fd7362204",
      "asset_path": "/Engine/BasicShapes/Cube.Cube",
      "rule_id": "static_mesh.nanite_state",
      "severity": "warning",
      "message": "Nanite is disabled; profile expects enabled.",
      "evidence_id": "ev-a9e2505e065747b9"
    },
    {
      "schema_version": "unreal-asset-audit@1.0.0",
      "issue_id": "issue-fad4971327c705d5",
      "asset_path": "/Engine/BasicShapes/Cylinder.Cylinder",
      "rule_id": "static_mesh.lod_count",
      "severity": "warning",
      "message": "LOD count 1 is below profile minimum 3.",
      "evidence_id": "ev-9df6a5369578ef76"
    },
    {
      "schema_version": "unreal-asset-audit@1.0.0",
      "issue_id": "issue-ba61dc2ba8713b7c",
      "asset_path": "/Engine/BasicShapes/Cylinder.Cylinder",
      "rule_id": "static_mesh.nanite_state",
      "severity": "warning",
      "message": "Nanite is disabled; profile expects enabled.",
      "evidence_id": "ev-1873a87527010097"
    },
    {
      "schema_version": "unreal-asset-audit@1.0.0",
      "issue_id": "issue-5b8be2dc42b089dd",
      "asset_path": "/Engine/BasicShapes/Sphere.Sphere",
      "rule_id": "static_mesh.lod_count",
      "severity": "warning",
      "message": "LOD count 1 is below profile minimum 3.",
      "evidence_id": "ev-dccfb872d8fca1d0"
    },
    {
      "schema_version": "unreal-asset-audit@1.0.0",
      "issue_id": "issue-29603fa839b86f33",
      "asset_path": "/Engine/BasicShapes/Sphere.Sphere",
      "rule_id": "static_mesh.nanite_state",
      "severity": "warning",
      "message": "Nanite is disabled; profile expects enabled.",
      "evidence_id": "ev-947dae0006e95a9c"
    }
  ],
  "evidence": [
    {
      "schema_version": "unreal-asset-audit@1.0.0",
      "evidence_id": "ev-6b4955343ce848ca",
      "asset_path": "/Engine/BasicShapes/Cone.Cone",
      "metric": "lod_count",
      "observed": 1,
      "expected": 3,
      "profile_pointer": "/rules/lod_count/min_count",
      "collector": "unreal_editor"
    },
    {
      "schema_version": "unreal-asset-audit@1.0.0",
      "evidence_id": "ev-0de65b05fdb36176",
      "asset_path": "/Engine/BasicShapes/Cone.Cone",
      "metric": "nanite_enabled",
      "observed": false,
      "expected": true,
      "profile_pointer": "/rules/nanite/expected",
      "collector": "unreal_editor"
    },
    {
      "schema_version": "unreal-asset-audit@1.0.0",
      "evidence_id": "ev-c7d42b9fc12bee42",
      "asset_path": "/Engine/BasicShapes/Cube.Cube",
      "metric": "lod_count",
      "observed": 1,
      "expected": 3,
      "profile_pointer": "/rules/lod_count/min_count",
      "collector": "unreal_editor"
    },
    {
      "schema_version": "unreal-asset-audit@1.0.0",
      "evidence_id": "ev-a9e2505e065747b9",
      "asset_path": "/Engine/BasicShapes/Cube.Cube",
      "metric": "nanite_enabled",
      "observed": false,
      "expected": true,
      "profile_pointer": "/rules/nanite/expected",
      "collector": "unreal_editor"
    },
    {
      "schema_version": "unreal-asset-audit@1.0.0",
      "evidence_id": "ev-9df6a5369578ef76",
      "asset_path": "/Engine/BasicShapes/Cylinder.Cylinder",
      "metric": "lod_count",
      "observed": 1,
      "expected": 3,
      "profile_pointer": "/rules/lod_count/min_count",
      "collector": "unreal_editor"
    },
    {
      "schema_version": "unreal-asset-audit@1.0.0",
      "evidence_id": "ev-1873a87527010097",
      "asset_path": "/Engine/BasicShapes/Cylinder.Cylinder",
      "metric": "nanite_enabled",
      "observed": false,
      "expected": true,
      "profile_pointer": "/rules/nanite/expected",
      "collector": "unreal_editor"
    },
    {
      "schema_version": "unreal-asset-audit@1.0.0",
      "evidence_id": "ev-dccfb872d8fca1d0",
      "asset_path": "/Engine/BasicShapes/Sphere.Sphere",
      "metric": "lod_count",
      "observed": 1,
      "expected": 3,
      "profile_pointer": "/rules/lod_count/min_count",
      "collector": "unreal_editor"
    },
    {
      "schema_version": "unreal-asset-audit@1.0.0",
      "evidence_id": "ev-947dae0006e95a9c",
      "asset_path": "/Engine/BasicShapes/Sphere.Sphere",
      "metric": "nanite_enabled",
      "observed": false,
      "expected": true,
      "profile_pointer": "/rules/nanite/expected",
      "collector": "unreal_editor"
    }
  ],
  "collection_failures": []
}
